Title,Source,URL,Summary
"India Access Control Gates Market Size, Competitive Analysis Reports 2025-2033 with Top Vendors | Taiwan News | Dec. 4, 2024 11:20",Taiwan News,https://taiwannews.com.tw/en/news/5984625,"India Access Control Gates Market Size Expands to Reach USD 248.6 Million by 2030

India Access Control Gates Market is flourishing because of the increasing security concerns and rising demand in commercial and residential sectors.

Request To Download Free Sample of This Strategic Report @-https://reportocean.com/industry-verticals/sample-request?report_id=bwcc19218

Report Ocean, a leading strategic consulting and market research firm, in its recent study, estimated India Access Control Gates Market size at USD 187.00 million in 2023. During the forecast period between 2024 and 2030, Report Ocean expects India Access Control Gates Market size to expand at a CAGR of 4.86% reaching a value of USD 248.60 million by 2030. Rapid residential and commercial project development, combined with the expansion of infrastructure, such as airports, railroads, smart cities, are key driving factors for India Access Control Gates Market. Moreover, the country's strong technological infrastructure and the quick adoption of cutting-edge technologies are expected to propel India Access Control Gates Market during the period in analysis.

Opportunity - Increasing Construction of Commercial Facilities

The rapid industrialization and economic growth are significantly fueling investment into the construction sector of India. The government as well as private players launched various real estate projects, such as offices, hotels, leisure parks, and others, to develop urban infrastructure. Navi Mumbai Hyperscale Data Center, Bund Garden Commercial Tower, and Gurgaon Shopping Mall are some of the major commercial projects of India. Furthermore, the government has also been focusing on the development of smart cities integrated with modernized technology, which is also anticipated to propel the demand for access control gates over the forecast period.

Get a Free Sample PDF copy of the report @-https://reportocean.com/industry-verticals/sample-request?report_id=bwcc19218

Impact of Escalating Geopolitical Tensions on India Access Control Gates Market

Escalating geopolitical tensions could impact various aspects of India Access Control Gates Market. When geopolitical tensions arise, for example, the need for access control may increase in order to guarantee increased security at certain locations, especially in the government, defense, and other vital infrastructure sectors. The market, however, can be hindered by a lack of materials and components for access control systems because of a supply chain disruption caused by rising geopolitical tensions. The interruption of the supply chain might also result in higher expenses or longer lead times for component procurement. Governments may impose more stringent laws pertaining to surveillance and security, which would need access control system modifications. Manufacturers may benefit from this, but compliance expenses may also rise.

Biometric Technology System Segment to Grow at Fastest CAGR

The pin/password systems technology holds the largest share of India Access Control Gates Market, owing to ease of use and cost-effectiveness compared to its counterparts. Pin/password systems are in demand in both residential and commercial gate entry systems. However, the biometric system segment is projected to register a significant growth rate during the forecast period.

North India Leads India Access Control Gates market

North India dominates India Access Control Gates Market, due to the rapid infrastructural development, particularly in the National Capital Region (NCR). Cities like Gurugram and Noida are attracting significant investments in both commercial and residential sectors. The increasing population and growing disposable income of consumers in the region are fueling their investment in advanced security systems, which is anticipated to fuel the demand for access control gates in North India during the forecast period.

Competitive Landscape

India Access Control Gates market is intensely competitive, as a number of companies are competing to gain a significant market share. Key players in the market include Godrej Security Solutions, Honeywell Security Products, Schindler, Hikvision, Dahua Technology, Axis Communications, Gallagher Security, ZKTeco, and Suprema.

Download Sample Report, SPECIAL OFFER (Avail an Up-to 30% discount on this report) @-https://reportocean.com/industry-verticals/sample-request?report_id=bwcc19218

To further enhance their market share, these companies employ various strategies, including mergers and acquisitions, partnerships, joint ventures, license agreements, and new product launches.

The in-depth analysis of the report provides information about growth potential, upcoming trends, and India Access Control Gates Market. It also highlights the factors driving forecasts of total market size. The report promises to provide recent technology trends in India Access Control Gates Market and industry insights to help decision-makers make sound strategic decisions. Furthermore, the report also analyzes the growth drivers, challenges, and competitive dynamics of the market.

Key questions answered in the Market are:

What is the consumer buying behaviors and preferences in the market?

What are the key success factors and critical considerations for market entry or expansion?

What are the potential risks and challenges for market participants?

What are the investment opportunities and potential returns in the market?

What are the market segmentation strategies and target market identification?

What are the marketing and advertising strategies employed by successful market players?

What are the market entry barriers and competitive intensity?

What are the market forecasts and projections for the future?

What are the recommended strategies for market participants to achieve success?

(*Note: The historical years and projected period in the report are flexible and can be tailored upon request. Additionally, the scope of the published report is adjustable to meet specific requirements, and customized analyses based on particular geographies or countries can be included as part of the customization.)

Access Full Report Description, TOC, Table of Figure, Chart, etc.-https://reportocean.com/industry-verticals/sample-request?report_id=bwcc19218

About Report Ocean:

Report Ocean is a renowned provider of market research reports, offering high-quality insights to clients in various industries. Their goal is to assist clients in achieving their top line and bottom line objectives, thereby enhancing their market share in today's competitive environment. As a trusted source for innovative market research reports, Report Ocean serves as a comprehensive solution for individuals, organizations, and industries seeking valuable market intelligence.

Contact Information:

Email:[email protected]

Address: 500 N Michigan Ave, Suite 600, Chicago, Illinois 60611, United States

Telephone: +1 888 212 3539 (US - Toll-Free)

For more information and to explore their offerings, visit their website at:https://www.reportocean.com/"
"Vietnam Surgical Equipment Market Size, Competitive Strategies, Key Trends, New Project Investment And Forecast up to 2025-2033 | Taiwan News | Dec. 4, 2024 11:39",Taiwan News,https://taiwannews.com.tw/en/news/5984628,"Vietnam Surgical Equipment Market Size Set to Touch USD 239 Million by 2030

Vietnam Surgical Equipment Market is flourishing because of increasing prevalence of chronic diseases and the government's supportive initiatives to promote the development of medical devices industry.

Request To Download Free Sample of This Strategic Report @-https://reportocean.com/industry-verticals/sample-request?report_id=bwcc19211

Report Ocean, a leading strategic consulting and market research firm, in its recent study, estimated Vietnam Surgical Equipment Market size at USD 153.34 million in 2023. During the forecast period between 2024 and 2030, Report Ocean expects Vietnam Surgical Equipment Market size to expand at a CAGR of 6.60% reaching a value of USD 238.88 million by 2030. The rising incidence of several chronic and lifestyle disorders as well as the rising demand for surgical operations are significant driving factors for Vietnam Surgical Equipment Market. Growing government measures to upgrade the nation's healthcare infrastructure and increasing healthcare expenditures are also expected to drive Vietnam Surgical Equipment Market in the coming years.

Opportunity - Expanding Medical Tourism in Vietnam

The expanding healthcare sector in Vietnam and increasing government investment in boosting the healthcare infrastructure are significantly attracting medical tourism in the country. According to a report by the Ho Chi Minh City Department of Tourism (DoT), around 300,000 foreigners visit Vietnam each year for medical examination and treatment. The expanding medical tourism in the country is mainly attributed to the availability of low-cost treatment, advanced medical technologies, and high quality medical services. As a result, with expanding medical tourism, the demand for surgical equipment is projected to rise, boosting the growth of Vietnam Surgical Equipment Market during the period in analysis.

Get a Free Sample PDF copy of the report @-https://reportocean.com/industry-verticals/sample-request?report_id=bwcc19211

Impact of Escalating Geopolitical Tensions on Vietnam Surgical Equipment Market

Escalating geopolitical tensions could negatively impact the growth of Vietnam Surgical Equipment Market. Vietnam imports a substantial volume of surgical equipment from other nations, such as China, Japan, the United States, and the European Union. However, supply chain disruption caused by geopolitical tensions and wars affects the availability of this equipment and drives up its cost. Local manufacturers are also impacted by the scarcity of raw materials needed to produce surgical equipment. Governments may also enact new rules to protect national security, which would have an effect on the medical devices industry. Manufacturers and distributors may incur additional costs and complexity in adhering to these rules.

Hospitals Segment Holds Largest Share of Market by End User

The hospitals segment dominates Vietnam Surgical Equipment Market by end user. The high number surgeries performed in hospitals and high financial resources available with them contributes to the segment growth. Hospitals in Vietnam significantly invest in high-quality and advanced surgical equipment which acts as a major catalyst for its market growth in the country. However, ambulatory surgical centers (ASCs) are expected to register high growth rate over the forecast period. The other major end user segments of Vietnam Surgical Equipment Market include clinics, diagnostic centers, and specialty clinics.

Competitive Landscape

Vietnam Surgical Equipment Market is intensely competitive, as a number of companies are competing to gain a significant market share. Key players in the market include Medtronic, Johnson & Johnson (J&J), B. Braun SE, BD (Becton, Dickinson and Company), KLS Martin, Dien Long Med Equipments Co. Ltd, VTH Vietnam Medical Equipment Company Ltd, Smith & Nephew, Trang Thi Medical, and Terumo Vietnam Medical Equipment Co., Ltd.

Download Sample Report, SPECIAL OFFER (Avail an Up-to 30% discount on this report) @-https://reportocean.com/industry-verticals/sample-request?report_id=bwcc19211

To further enhance their market share, these companies employ various strategies, including mergers and acquisitions, partnerships, joint ventures, license agreements, and new product launches.

The in-depth analysis of the report provides information about growth potential, upcoming trends, and Vietnam Surgical Equipment Market. It also highlights the factors driving forecasts of total market size. The report promises to provide recent technology trends in Vietnam Surgical Equipment Market and industry insights to help decision-makers make sound strategic decisions. Furthermore, the report also analyzes the growth drivers, challenges, and competitive dynamics of the market.

Key questions answered in the Market are:

What is the consumer buying behaviors and preferences in the market?

What are the key success factors and critical considerations for market entry or expansion?

What are the potential risks and challenges for market participants?

What are the investment opportunities and potential returns in the market?

What are the market segmentation strategies and target market identification?

What are the marketing and advertising strategies employed by successful market players?

What are the market entry barriers and competitive intensity?

What are the market forecasts and projections for the future?

What are the recommended strategies for market participants to achieve success?

(*Note: The historical years and projected period in the report are flexible and can be tailored upon request. Additionally, the scope of the published report is adjustable to meet specific requirements, and customized analyses based on particular geographies or countries can be included as part of the customization.)

Access Full Report Description, TOC, Table of Figure, Chart, etc.-https://reportocean.com/industry-verticals/sample-request?report_id=bwcc19211

About Report Ocean:

Report Ocean is a renowned provider of market research reports, offering high-quality insights to clients in various industries. Their goal is to assist clients in achieving their top line and bottom line objectives, thereby enhancing their market share in today's competitive environment. As a trusted source for innovative market research reports, Report Ocean serves as a comprehensive solution for individuals, organizations, and industries seeking valuable market intelligence.

Contact Information:

Email:[email protected]

Address: 500 N Michigan Ave, Suite 600, Chicago, Illinois 60611, United States

Telephone: +1 888 212 3539 (US - Toll-Free)

For more information and to explore their offerings, visit their website at:https://www.reportocean.com/"
Persistent tracking is vital to safeguard shipping in dark seas,LNG Industry,https://www.lngindustry.com/special-reports/04122024/persistent-tracking-is-vital-to-safeguard-shipping-in-dark-seas/,"The ever-worsening geopolitical situation is creating unprecedented challenges for the shipping sector and wider supply chain. An expanding shadow fleet, openly undertaking illegal ship-to-ship (STS) transfers of Russian oil and LNG, has compounded the longer-standing dark shipping problem that has emerged as a result of illegal activity (people, arms, drugs, contraband, and fish smuggling), which not only threatens national security, but also the safety of vessels and heightens concerns regarding environmental disaster and supply chain disruption.

In response, the International Maritime Organization (IMO) issued an Assembly Resolution A.1192(33) in December 2023 urging governments and all related stakeholders to undertake measures to address the shadow fleet. While stakehold-ers are still predominantly reliant upon automatic identification system (AIS) ves-sel tracking, however, the dark ship problem will continue. It is it simply too easy for bad actors to turn off, jam, or spoof AIS tracking.

Enhanced fleet tracking is now a priority that can only be achieved if stake-holders can evolve beyond the simplicity of AIS to a multi-layered tracking model that leverages diverse data sources and real-time analytics to provide the next generation of accurate, trusted vessel positioning.

The United Nations Convention on the Law of the Sea (UNCLOS), the global maritime order on which all countries depend to protect global shipping and supply chains, is under untenable strain. The escalating geopolitical uncertainty across the Black Sea/Crimea, South China Sea/Spratly Islands, Red Sea-Gulf of Aden/Yemen, along with the Straits of Hormuz/Iran is seriously undermining this order. Indeed, the rise in attacks on shipping in the Red Sea and Gulf of Aden is causing ship masters themselves to switch off AIS tracking in a bid to avoid being targeted. While this may remove immediate vulnerability to this threat, ships operating without AIS significantly raise the risk of collision, with associated potential loss of life and environmental damage, as well as creating supply chain uncertainty.

The lack of transparency in shipping is now of a global concern to those governments and stakeholders that wish to operate in compliance, creating a world of good actors and bad actors. The shift by Russian oil tankers away from the large open registries to smaller, less diligent flags in response to heightened sanctions from the US, EU, the UK, and others, further underlines the complexities facing the IMO and national regulatory bodies attempting to reinstate order.

Fast on the heels of the IMO Assembly Resolution, the US issued a Quint Seal Notice from its key regulators later in December 2023 calling on all stakeholders, including vessel owners, charterers, exporters, brokers, shipping companies, freight forwarders, commodities traders, and financial institutions, to assess their risk profiles and implement risk-based compliance programs.

Whilst the need to improve shipping transparency is a given, solving it is far from straightforward. It is generally outside the capability of a single organisation for reasons of specialisation; involving data selection, aggregation, management/storage, artificial intelligence (AI)/machine learning (ML) processing, and overall technical complexity and cost - thus it is best to align with an established specialist application service provider.

The regulatory demand for stakeholders to strengthen and utilise enhanced fleet tracking demonstrates concern over the current limitations of tracking solutions. The ease with which illicit shipping can affect AIS tracking, through switching-off, spoofing, and jamming, confirms that this ubiquitous system is not reliable enough to provide the tracking rigour required for today's maritime security, safety, environmental, and sanctions compliance needs. Continued reliance on AIS alone will compromise attempts at compliance enforcement. The industry now urgently requires a more robust solution that leverages multiple tracking data sources supplemented at times with affordable earth-observation (EO) data sources to deliver persistent tracking of every vessel without compromise.

The call for an enhanced compliance focus has highlighted to stakeholders the inherent risks associated with relying solely on AIS tracking. Stakeholders require a far more reliable tracking solution that overcomes AIS vulnerabilities, not only in high-risk areas (HRAs) but also in known jamming areas, ports, and high-ship density areas subject to signal contention where tracking information can sometimes be hard to attain or is disrupted.

Persistent tracking overlays multiple vessel tracking services and data sources, including AIS and secure point-to-point satellite tracking systems (Inmarat-C, Iridium, etc.), voyage plans when available, EO-data when relevant, and uses real-time analytics to transform the accuracy and reliability and vessel location data.

With multiple, layered data sources and robust cross referencing and analysis, the persistent tracking model allows stakeholders to have increased confidence in the true vessel position. Guessing is eliminated and errors associated with false positives are minimised, allowing stakeholders to ensure any anomaly or vessel deviation is immediately identified and notified, and open to investigation.

Multiple, diverse vessel detection technologies feed into live dashboards, providing stakeholders with the essential visibility and control required to confidently locate and manage vessels. By adding the power of predictive analytics, AI and ML, stakeholders can gain far more insight into the extent of dark activity and ensure secure, safe, clean, and compliant operations.

The simplicity of AIS has transformed the accessibility of vessel tracking over the past few decades. But in today's overcrowded and high-risk seas, that simplicity is now a liability. It is too easy to disable, jam, or spoof AIS signals, creating inconsistencies in vessel track data that allow bad actors to operate unchallenged while genuine vessels' safety is also compromised. Add in signal blockages caused by the congestion of positions being transmitted and stakeholders increasingly recognise that the gaps appearing in tracking systems globally are creating untenable risk.

From compromised security and loss of life to environmental disaster, supply chain disruption to escalating insurance costs, the lack of visibility across seas globally must be urgently addressed. Proposing additional sanctions and greater risk assessment is a necessary start, but without a persistent tracking solution that can layer multiple tracking data streams to overcome the current information gaps, the maritime industry will continue to incur unacceptable risk.

Written by Captain Steve Bomgardner, VP - Shipping & Offshore, Pole Star Global."
Future of retail giant's Haverfordwest store remains unclear,Western Telegraph,https://www.westerntelegraph.co.uk/news/24770819.future-homebase-haverfordwest-store-remains-unclear/,"The future of a retail giant's Pembrokeshire store remains uncertain, as administrators say they it is not currently provide information as to what will happen to it.

Homebase announced that it was going into administration last month. The DIY and gardening retailer has two stores in Wales, one of which is located at Haverfordwest's Wyndham Retail Park.

The joint administrators acting for Homebase, Gavin Park, Gavin Maher and Adele Macleod of Teneo Financial Advisory Limited, have completed a sale of up to 70 UK stores to IP to CDS (Superstores International) trading as The Range and Wilko, which is expected to secure up to 1,600 jobs.

Homebase stores will continue to trade until handed over to CDS. Homebase had recently completed on the sale of 11 UK stores to Sainsbury's and has exchanged on a further three.

The remaining 49 UK stores will continue to trade as normal while the joint administrators continue active discussions with interested parties.

It is, at present unclear where Haverfordwest's Homebase store fits into all this, with a spokesperson for Teneo unable to confirm if the Haverfordwest store would be closing and if so, when.

""We are not giving out any additional detail beyond what was in the original announcement,"" said the spokesperson. ""All stores are continuing to trade.""

A statement by Homebase said that the company had experienced a decline in sales over the last three years, resulting from worsening consumer confidence and available discretionary spend, which has coincided with a rise in input costs and supply chain disruption.

Homebase employs around 3,600 staff across its UK operations and there were not expected to be immediate redundancies while the administrators urgently assess the position of the companies.

All employee wages and benefits will be paid for their period of employment. Customer orders will still be fulfilled as far as possible and arrangements will be put in place to allow gift vouchers to be used.

""It has been an incredibly challenging three years for the home and garden improvement market,"" said Damian McGloughlin, CEO of Homebase.

He said that the business had have taken many and wide-ranging actions to improve trading but these had not had the necessary effect.

He said that his priority continues to be the company's team members.

""I want to thank our team members and supplier partners from the bottom of my heart for their hard work and commitment over many years.""

Gavin Maher, Joint Administrator added: ""The sale to CDS preserves the Homebase brand and secures a significant number of jobs and we hope to complete sales of additional stores over the coming weeks.

""The remainder of the stores will continue to trade whilst buyers are sought. We thank Homebase's team members and other stakeholders for their continued support."""
